{
  "event_id": "11111111-1111-1111-1111-111111111112",
  "aggregate_id": "22222222-2222-2222-2222-222222222222",
  "event_type": "PasswordResetRequested",
  "version": 1,
  "occurred_at": "2026-08-28T09:05:00+00:00",
  "payload": {
    "user_id": "22222222-2222-2222-2222-222222222222",
    "email": "new.user@example.com",
    "reset_token_reference_id": "33333333-3333-3333-3333-333333333334",
    "requested_at": "2026-08-28T09:05:00+00:00"
  },
  "metadata": {
    "correlation_id": "44444444-4444-4444-4444-444444444445",
    "causation_id": "44444444-4444-4444-4444-444444444445",
    "user_id": "22222222-2222-2222-2222-222222222222"
  }
}

